{
  "name": "claw-forge",
  "version": "0.1.0",
  "license": "Apache-2.0",
  "author": {
    "name": "Bowen Li",
    "url": "https://github.com/bowenli86"
  },
  "homepage": "https://github.com/bowenli86/claw-forge-plugin",
  "repository": {
    "type": "git",
    "url": "https://github.com/bowenli86/claw-forge-plugin.git"
  },
  "keywords": ["autonomous", "agent", "spec-driven", "orchestration"]
}
